turnstilelink_link_1,turnstilelink_link_1/_text,turnstilelink_link_1/_title,company_content,company_link,company_link/_text,company_link/_title,turnstilelink_link_2,turnstilelink_link_2/_text,turnstilelink_link_2/_title,turnstilelink_link_2_numbers,ratingnumber_number,slnounderline_value,slnounderline_value_numbers,location_value,moreloc_link,moreloc_link/_text,moreloc_link/_title,moreloc_link_numbers,snip_value,snip_value_prices,snip_values,summary_description,resultlinktext_value,resultlinkblock_value,date_value,date_value_numbers,label,savejob_label,email_link,email_link/_text,email_link/_title,more_label,mat_contents,mat_links,mat_links/_text,mat_links/_title,content,content_prices,links,links/_text,links/_title,"_PAGE_NUMBER"
"http://www.indeed.co.uk/rc/clk?jk=9c7a6aef74ac07b8","Equipment Scientist [FY16-056]","Equipment Scientist [FY16-056]","Patheon Inc.","http://www.indeed.co.uk/cmp/Patheon-Inc.?from=SERP&campaignid=serp-linkcompanyname&fromjk=9c7a6aef74ac07b8&jcid=6b41dbc41bc599f3","Patheon Inc.","","http://www.indeed.co.uk/cmp/Patheon-Inc./reviews?jcid=6b41dbc41bc599f3","4.03 reviews","Patheon reviews","4.03","4","3 reviews","3","Milton","","","","","","","","The equipment scientists update/maintain the equipment spreadsheet to ensure that all calibration/qualification data is up to date....","2 days ago","","","","-","save job","mailto:?subject=I%20found%20this%20job%20on%20Indeed&body=http://www.indeed.co.uk","email","","more...","View all Patheon Inc. jobs - Milton jobs; Salary Search: Scientist salaries in Milton","http://www.indeed.co.uk/Patheon-Inc.-jobs; http://www.indeed.co.uk/jobs-in-Milton; http://www.indeed.co.uk/salaries/Scientist-Salaries,-Milton-ENG?fromjk=9c7a6aef74ac07b8&from=serp-more&campaignid=serp-more","Patheon Inc. jobs; Milton jobs; Scientist salaries in Milton","","Equipment Scientist [FY16-056] Patheon Inc. - 4.03 reviews - Milton The equipment scientists update/maintain the equipment spreadsheet to ensure that all calibration/qualification data is up to date.... 2 days ago - save job - email - more... View all Patheon Inc. jobs - Milton jobs Salary Search: Scientist salaries in Milton","","http://www.indeed.co.uk/rc/clk?jk=9c7a6aef74ac07b8; http://www.indeed.co.uk/cmp/Patheon-Inc.?from=SERP&campaignid=serp-linkcompanyname&fromjk=9c7a6aef74ac07b8&jcid=6b41dbc41bc599f3; http://www.indeed.co.uk/cmp/Patheon-Inc./reviews?jcid=6b41dbc41bc599f3; http://www.indeed.co.uk/jobs?q=data+scientist&l=England&start=140#; mailto:?subject=I%20found%20this%20job%20on%20Indeed&body=http://www.indeed.co.uk; http://www.indeed.co.uk/jobs?q=data+scientist&l=England&start=140#; http://www.indeed.co.uk/jobs?q=data+scientist&l=England&start=140#; http://www.indeed.co.uk/Patheon-Inc.-jobs; http://www.indeed.co.uk/jobs-in-Milton; http://www.indeed.co.uk/salaries/Scientist-Salaries,-Milton-ENG?fromjk=9c7a6aef74ac07b8&from=serp-more&campaignid=serp-more","Equipment Scientist [FY16-056]; Patheon Inc.; 4.03 reviews; save job; email; more...; ; Patheon Inc. jobs; Milton jobs; Scientist salaries in Milton","Equipment Scientist [FY16-056]; ; Patheon reviews; Save this job to my.indeed; ; ; Close; ; ; ","15"
"http://www.indeed.co.uk/rc/clk?jk=577f28fc5bac692b","BI Data Scientist","BI Data Scientist","Sainsburys","http://www.indeed.co.uk/cmp/J-Sainsbury-Plc.?from=SERP&campaignid=serp-linkcompanyname&fromjk=577f28fc5bac692b&jcid=71e3e682250cd3ad","Sainsburys","","http://www.indeed.co.uk/cmp/J-Sainsbury-Plc./reviews?jcid=71e3e682250cd3ad","3.81,932 reviews","Sainsburys reviews","381.932","3.8","1,932 reviews","1932","London","","","","","","","Full-time, Permanent","Advice and support from team, Snr Data scientist and A&C manager. The Data Scientist will be responsible for delivering key insight to the business, through the...","30+ days ago","","","","-","save job","mailto:?subject=I%20found%20this%20job%20on%20Indeed&body=http://www.indeed.co.uk","email","","more...","View all Sainsburys jobs - London jobs; Salary Search: Data Scientist salaries in London; Learn more about working at Sainsburys","http://www.indeed.co.uk/Sainsburys-jobs; http://www.indeed.co.uk/jobs-in-London; http://www.indeed.co.uk/salaries/Data-Scientist-Salaries,-London-ENG?fromjk=577f28fc5bac692b&from=serp-more&campaignid=serp-more; http://www.indeed.co.uk/cmp/J-Sainsbury-Plc.?fromjk=577f28fc5bac692b&from=serp-more&campaignid=serp-more&jcid=71e3e682250cd3ad","Sainsburys jobs; London jobs; Data Scientist salaries in London; Sainsburys","","BI Data Scientist Sainsburys - 3.81,932 reviews - London Full-time, Permanent Advice and support from team, Snr Data scientist and A&C manager. The Data Scientist will be responsible for delivering key insight to the business, through the... 30+ days ago - save job - email - more... View all Sainsburys jobs - London jobs Salary Search: Data Scientist salaries in London Learn more about working at Sainsburys","","http://www.indeed.co.uk/rc/clk?jk=577f28fc5bac692b; http://www.indeed.co.uk/cmp/J-Sainsbury-Plc.?from=SERP&campaignid=serp-linkcompanyname&fromjk=577f28fc5bac692b&jcid=71e3e682250cd3ad; http://www.indeed.co.uk/cmp/J-Sainsbury-Plc./reviews?jcid=71e3e682250cd3ad; http://www.indeed.co.uk/jobs?q=data+scientist&l=England&start=140#; mailto:?subject=I%20found%20this%20job%20on%20Indeed&body=http://www.indeed.co.uk; http://www.indeed.co.uk/jobs?q=data+scientist&l=England&start=140#; http://www.indeed.co.uk/jobs?q=data+scientist&l=England&start=140#; http://www.indeed.co.uk/Sainsburys-jobs; http://www.indeed.co.uk/jobs-in-London; http://www.indeed.co.uk/salaries/Data-Scientist-Salaries,-London-ENG?fromjk=577f28fc5bac692b&from=serp-more&campaignid=serp-more; http://www.indeed.co.uk/cmp/J-Sainsbury-Plc.?fromjk=577f28fc5bac692b&from=serp-more&campaignid=serp-more&jcid=71e3e682250cd3ad","BI Data Scientist; Sainsburys; 3.81,932 reviews; save job; email; more...; ; Sainsburys jobs; London jobs; Data Scientist salaries in London; Sainsburys","BI Data Scientist; ; Sainsburys reviews; Save this job to my.indeed; ; ; Close; ; ; ; ","15"
"http://www.indeed.co.uk/rc/clk?jk=b7c51dc89d2f540b","Data Scientist – London","Data Scientist – London","comparethemarket.com","","","","","","","","","","","Peterborough","","","","","","","","Compare The Market...","16 days ago","","","","-","save job","mailto:?subject=I%20found%20this%20job%20on%20Indeed&body=http://www.indeed.co.uk","email","","more...","View all comparethemarket.com jobs - Peterborough jobs; Salary Search: Data Scientist salaries in Peterborough","http://www.indeed.co.uk/Comparethemarket.com-jobs; http://www.indeed.co.uk/jobs-in-Peterborough; http://www.indeed.co.uk/salaries/Data-Scientist-Salaries,-Peterborough-ENG?fromjk=b7c51dc89d2f540b&from=serp-more&campaignid=serp-more","comparethemarket.com jobs; Peterborough jobs; Data Scientist salaries in Peterborough","","Data Scientist – London comparethemarket.com - Peterborough Compare The Market... 16 days ago - save job - email - more... View all comparethemarket.com jobs - Peterborough jobs Salary Search: Data Scientist salaries in Peterborough","","http://www.indeed.co.uk/rc/clk?jk=b7c51dc89d2f540b; http://www.indeed.co.uk/jobs?q=data+scientist&l=England&start=140#; mailto:?subject=I%20found%20this%20job%20on%20Indeed&body=http://www.indeed.co.uk; http://www.indeed.co.uk/jobs?q=data+scientist&l=England&start=140#; http://www.indeed.co.uk/jobs?q=data+scientist&l=England&start=140#; http://www.indeed.co.uk/Comparethemarket.com-jobs; http://www.indeed.co.uk/jobs-in-Peterborough; http://www.indeed.co.uk/salaries/Data-Scientist-Salaries,-Peterborough-ENG?fromjk=b7c51dc89d2f540b&from=serp-more&campaignid=serp-more","Data Scientist – London; save job; email; more...; ; comparethemarket.com jobs; Peterborough jobs; Data Scientist salaries in Peterborough","Data Scientist – London; Save this job to my.indeed; ; ; Close; ; ; ","15"
"http://www.indeed.co.uk/rc/clk?jk=e35c08789e019d9a","Data Scientist - Financial ECommerce","Data Scientist - Financial ECommerce","Scott Merrick LLP","","","","","","","","","","","London","","","","","£65,000 - £85,000 a year","65000; -85000","- Permanent","Data Scientist - Financial ECommerce. As a Senior Data Scientist, you'll have excellent analytical and problem solving skills....","Mail Online","-","15 days ago","15","-","save job","mailto:?subject=I%20found%20this%20job%20on%20Indeed&body=http://www.indeed.co.uk","email","","more...","View all Scott Merrick LLP jobs - London jobs; Salary Search: Data Scientist salaries in London","http://www.indeed.co.uk/Scott-Merrick-LLP-jobs; http://www.indeed.co.uk/jobs-in-London; http://www.indeed.co.uk/salaries/Data-Scientist-Salaries,-London-ENG?fromjk=e35c08789e019d9a&from=serp-more&campaignid=serp-more","Scott Merrick LLP jobs; London jobs; Data Scientist salaries in London","","Data Scientist - Financial ECommerce Scott Merrick LLP - London £65,000 - £85,000 a year - Permanent Data Scientist - Financial ECommerce. As a Senior Data Scientist, you'll have excellent analytical and problem solving skills.... Mail Online - 15 days ago - save job - email - more... View all Scott Merrick LLP jobs - London jobs Salary Search: Data Scientist salaries in London","65000; -85000","http://www.indeed.co.uk/rc/clk?jk=e35c08789e019d9a; http://www.indeed.co.uk/jobs?q=data+scientist&l=England&start=150#; mailto:?subject=I%20found%20this%20job%20on%20Indeed&body=http://www.indeed.co.uk; http://www.indeed.co.uk/jobs?q=data+scientist&l=England&start=150#; http://www.indeed.co.uk/jobs?q=data+scientist&l=England&start=150#; http://www.indeed.co.uk/Scott-Merrick-LLP-jobs; http://www.indeed.co.uk/jobs-in-London; http://www.indeed.co.uk/salaries/Data-Scientist-Salaries,-London-ENG?fromjk=e35c08789e019d9a&from=serp-more&campaignid=serp-more","Data Scientist - Financial ECommerce; save job; email; more...; ; Scott Merrick LLP jobs; London jobs; Data Scientist salaries in London","Data Scientist - Financial ECommerce; Save this job to my.indeed; ; ; Close; ; ; ","16"
"http://www.indeed.co.uk/rc/clk?jk=6a5e41079bf59a59","Applied Scientist - Bing","Applied Scientist - Bing","Microsoft","http://www.indeed.co.uk/cmp/Microsoft?from=SERP&campaignid=serp-linkcompanyname&fromjk=6a5e41079bf59a59&jcid=734cb5a01ee60f80","Microsoft","","http://www.indeed.co.uk/cmp/Microsoft/reviews?jcid=734cb5a01ee60f80","4.22,211 reviews","Microsoft reviews","422.211","4.2","2,211 reviews","2211","London","","","","","","","","Data mining solutions on text data. Deep interactions with research, incubation projects, Big Data systems, relevance measurements and data mining are just some...","4 days ago","","","","-","save job","mailto:?subject=I%20found%20this%20job%20on%20Indeed&body=http://www.indeed.co.uk","email","","more...","View all Microsoft jobs - London jobs; Salary Search: Scientist salaries in London; Learn more about working at Microsoft","http://www.indeed.co.uk/Microsoft-jobs; http://www.indeed.co.uk/jobs-in-London; http://www.indeed.co.uk/salaries/Scientist-Salaries,-London-ENG?fromjk=6a5e41079bf59a59&from=serp-more&campaignid=serp-more; http://www.indeed.co.uk/cmp/Microsoft?fromjk=6a5e41079bf59a59&from=serp-more&campaignid=serp-more&jcid=734cb5a01ee60f80","Microsoft jobs; London jobs; Scientist salaries in London; Microsoft","","Applied Scientist - Bing Microsoft - 4.22,211 reviews - London Data mining solutions on text data. Deep interactions with research, incubation projects, Big Data systems, relevance measurements and data mining are just some... 4 days ago - save job - email - more... View all Microsoft jobs - London jobs Salary Search: Scientist salaries in London Learn more about working at Microsoft","","http://www.indeed.co.uk/rc/clk?jk=6a5e41079bf59a59; http://www.indeed.co.uk/cmp/Microsoft?from=SERP&campaignid=serp-linkcompanyname&fromjk=6a5e41079bf59a59&jcid=734cb5a01ee60f80; http://www.indeed.co.uk/cmp/Microsoft/reviews?jcid=734cb5a01ee60f80; http://www.indeed.co.uk/jobs?q=data+scientist&l=England&start=150#; mailto:?subject=I%20found%20this%20job%20on%20Indeed&body=http://www.indeed.co.uk; http://www.indeed.co.uk/jobs?q=data+scientist&l=England&start=150#; http://www.indeed.co.uk/jobs?q=data+scientist&l=England&start=150#; http://www.indeed.co.uk/Microsoft-jobs; http://www.indeed.co.uk/jobs-in-London; http://www.indeed.co.uk/salaries/Scientist-Salaries,-London-ENG?fromjk=6a5e41079bf59a59&from=serp-more&campaignid=serp-more; http://www.indeed.co.uk/cmp/Microsoft?fromjk=6a5e41079bf59a59&from=serp-more&campaignid=serp-more&jcid=734cb5a01ee60f80","Applied Scientist - Bing; Microsoft; 4.22,211 reviews; save job; email; more...; ; Microsoft jobs; London jobs; Scientist salaries in London; Microsoft","Applied Scientist - Bing; ; Microsoft reviews; Save this job to my.indeed; ; ; Close; ; ; ; ","16"
"http://www.indeed.co.uk/rc/clk?jk=54b49b1c029aeae3","ASOS Careers| Data Scientist | London","ASOS Careers| Data Scientist | London","ASOS","","","","","","","","","","","London","","","","","","","","We are looking for Data Scientists at all levels of experience to work across several business areas including Recommendations, Customer Profiling, Forecasting...","30+ days ago","","","","-","save job","mailto:?subject=I%20found%20this%20job%20on%20Indeed&body=http://www.indeed.co.uk","email","","more...","View all ASOS jobs - London jobs; Salary Search: Data Scientist salaries in London; Learn more about working at Asos","http://www.indeed.co.uk/Asos-jobs; http://www.indeed.co.uk/jobs-in-London; http://www.indeed.co.uk/salaries/Data-Scientist-Salaries,-London-ENG?fromjk=54b49b1c029aeae3&from=serp-more&campaignid=serp-more; http://www.indeed.co.uk/cmp/Asos?fromjk=54b49b1c029aeae3&from=serp-more&campaignid=serp-more&jcid=e8a6ca0e808e10da","ASOS jobs; London jobs; Data Scientist salaries in London; Asos","","ASOS Careers| Data Scientist | London ASOS - London We are looking for Data Scientists at all levels of experience to work across several business areas including Recommendations, Customer Profiling, Forecasting... 30+ days ago - save job - email - more... View all ASOS jobs - London jobs Salary Search: Data Scientist salaries in London Learn more about working at Asos","","http://www.indeed.co.uk/rc/clk?jk=54b49b1c029aeae3; http://www.indeed.co.uk/jobs?q=data+scientist&l=England&start=150#; mailto:?subject=I%20found%20this%20job%20on%20Indeed&body=http://www.indeed.co.uk; http://www.indeed.co.uk/jobs?q=data+scientist&l=England&start=150#; http://www.indeed.co.uk/jobs?q=data+scientist&l=England&start=150#; http://www.indeed.co.uk/Asos-jobs; http://www.indeed.co.uk/jobs-in-London; http://www.indeed.co.uk/salaries/Data-Scientist-Salaries,-London-ENG?fromjk=54b49b1c029aeae3&from=serp-more&campaignid=serp-more; http://www.indeed.co.uk/cmp/Asos?fromjk=54b49b1c029aeae3&from=serp-more&campaignid=serp-more&jcid=e8a6ca0e808e10da","ASOS Careers| Data Scientist | London; save job; email; more...; ; ASOS jobs; London jobs; Data Scientist salaries in London; Asos","ASOS Careers| Data Scientist | London; Save this job to my.indeed; ; ; Close; ; ; ; ","16"
"http://www.indeed.co.uk/rc/clk?jk=ffc97cb97852fd0b","Data Scientist - Games, London","Data Scientist - Games, London","Datascope","http://www.indeed.co.uk/cmp/Datascope?from=SERP&campaignid=serp-linkcompanyname&fromjk=ffc97cb97852fd0b&jcid=fb5608985b7436a3","Datascope","","http://www.indeed.co.uk/cmp/Datascope/reviews?jcid=fb5608985b7436a3","3.02 reviews","Datascope reviews","3.02","3","2 reviews","2","London","","","","","£65,000 a year","65000","","This major games company are seeking a top-level game Data Scientist to join their analytics team to analyse player behaviour, settle questions about game...","Games Industry Jobs","-","10 days ago","10","-","save job","mailto:?subject=I%20found%20this%20job%20on%20Indeed&body=http://www.indeed.co.uk","email","","more...","View all Datascope jobs - London jobs; Salary Search: Data Scientist salaries in London","http://www.indeed.co.uk/Datascope-jobs; http://www.indeed.co.uk/jobs-in-London; http://www.indeed.co.uk/salaries/Data-Scientist-Salaries,-London-ENG?fromjk=ffc97cb97852fd0b&from=serp-more&campaignid=serp-more","Datascope jobs; London jobs; Data Scientist salaries in London","","Data Scientist - Games, London Datascope - 3.02 reviews - London £65,000 a year This major games company are seeking a top-level game Data Scientist to join their analytics team to analyse player behaviour, settle questions about game... Games Industry Jobs - 10 days ago - save job - email - more... View all Datascope jobs - London jobs Salary Search: Data Scientist salaries in London","65000","http://www.indeed.co.uk/rc/clk?jk=ffc97cb97852fd0b; http://www.indeed.co.uk/cmp/Datascope?from=SERP&campaignid=serp-linkcompanyname&fromjk=ffc97cb97852fd0b&jcid=fb5608985b7436a3; http://www.indeed.co.uk/cmp/Datascope/reviews?jcid=fb5608985b7436a3; http://www.indeed.co.uk/jobs?q=data+scientist&l=England&start=150#; mailto:?subject=I%20found%20this%20job%20on%20Indeed&body=http://www.indeed.co.uk; http://www.indeed.co.uk/jobs?q=data+scientist&l=England&start=150#; http://www.indeed.co.uk/jobs?q=data+scientist&l=England&start=150#; http://www.indeed.co.uk/Datascope-jobs; http://www.indeed.co.uk/jobs-in-London; http://www.indeed.co.uk/salaries/Data-Scientist-Salaries,-London-ENG?fromjk=ffc97cb97852fd0b&from=serp-more&campaignid=serp-more","Data Scientist - Games, London; Datascope; 3.02 reviews; save job; email; more...; ; Datascope jobs; London jobs; Data Scientist salaries in London","Data Scientist - Games, London; ; Datascope reviews; Save this job to my.indeed; ; ; Close; ; ; ","16"
"http://www.indeed.co.uk/rc/clk?jk=be359f8d07e7d8da","Developer","Developer","Reed Business Information","http://www.indeed.co.uk/cmp/Reed-Business-Information?from=SERP&campaignid=serp-linkcompanyname&fromjk=be359f8d07e7d8da&jcid=fe8b4fdb8a17a513","Reed Business Information","","http://www.indeed.co.uk/cmp/Reed-Business-Information/reviews?jcid=fe8b4fdb8a17a513","3.826 reviews","Reed Business Information reviews","3.826","3.8","26 reviews","26","Sutton","","","","","","","","You will join a project team delivering a data rich, highly interactive commercial web based product to customers of one of our most innovative businesses....","30+ days ago","","","","-","save job","mailto:?subject=I%20found%20this%20job%20on%20Indeed&body=http://www.indeed.co.uk","email","","more...","View all Reed Business Information jobs - Sutton jobs; Salary Search: Developer salaries in Sutton; Learn more about working at Reed Business Information","http://www.indeed.co.uk/Reed-Business-Information-jobs; http://www.indeed.co.uk/jobs-in-Sutton; http://www.indeed.co.uk/salaries/Developer-Salaries,-Sutton-ENG?fromjk=be359f8d07e7d8da&from=serp-more&campaignid=serp-more; http://www.indeed.co.uk/cmp/Reed-Business-Information?fromjk=be359f8d07e7d8da&from=serp-more&campaignid=serp-more&jcid=fe8b4fdb8a17a513","Reed Business Information jobs; Sutton jobs; Developer salaries in Sutton; Reed Business Information","","Developer Reed Business Information - 3.826 reviews - Sutton You will join a project team delivering a data rich, highly interactive commercial web based product to customers of one of our most innovative businesses.... 30+ days ago - save job - email - more... View all Reed Business Information jobs - Sutton jobs Salary Search: Developer salaries in Sutton Learn more about working at Reed Business Information","","http://www.indeed.co.uk/rc/clk?jk=be359f8d07e7d8da; http://www.indeed.co.uk/cmp/Reed-Business-Information?from=SERP&campaignid=serp-linkcompanyname&fromjk=be359f8d07e7d8da&jcid=fe8b4fdb8a17a513; http://www.indeed.co.uk/cmp/Reed-Business-Information/reviews?jcid=fe8b4fdb8a17a513; http://www.indeed.co.uk/jobs?q=data+scientist&l=England&start=150#; mailto:?subject=I%20found%20this%20job%20on%20Indeed&body=http://www.indeed.co.uk; http://www.indeed.co.uk/jobs?q=data+scientist&l=England&start=150#; http://www.indeed.co.uk/jobs?q=data+scientist&l=England&start=150#; http://www.indeed.co.uk/Reed-Business-Information-jobs; http://www.indeed.co.uk/jobs-in-Sutton; http://www.indeed.co.uk/salaries/Developer-Salaries,-Sutton-ENG?fromjk=be359f8d07e7d8da&from=serp-more&campaignid=serp-more; http://www.indeed.co.uk/cmp/Reed-Business-Information?fromjk=be359f8d07e7d8da&from=serp-more&campaignid=serp-more&jcid=fe8b4fdb8a17a513","Developer; Reed Business Information; 3.826 reviews; save job; email; more...; ; Reed Business Information jobs; Sutton jobs; Developer salaries in Sutton; Reed Business Information","Developer; ; Reed Business Information reviews; Save this job to my.indeed; ; ; Close; ; ; ; ","16"
"http://www.indeed.co.uk/rc/clk?jk=5d2d3e63d71c1381","FS IT Advisory/FinTech Consulting Roles","FS IT Advisory/FinTech Consulting Roles","Consulting Point","","","","","","","","","","","London","","","","","£80,000 - £150,000 a year","80000; -150000","","Data Architects, Data Scientists. Big Data / Analytics / Data Science. Big Data, Customer data and Information Management (IM)....","Consultancy Role Finder","-","23 hours ago","23","-","save job","mailto:?subject=I%20found%20this%20job%20on%20Indeed&body=http://www.indeed.co.uk","email","","more...","View all Consulting Point jobs - London jobs; Salary Search: IT Analyst salaries in London; Learn more about working at Consulting Point","http://www.indeed.co.uk/Consulting-Point-jobs; http://www.indeed.co.uk/jobs-in-London; http://www.indeed.co.uk/salaries/IT-Analyst-Salaries,-London-ENG?fromjk=5d2d3e63d71c1381&from=serp-more&campaignid=serp-more; http://www.indeed.co.uk/cmp/Consulting-Point?fromjk=5d2d3e63d71c1381&from=serp-more&campaignid=serp-more&jcid=d98473706de8b025","Consulting Point jobs; London jobs; IT Analyst salaries in London; Consulting Point","","FS IT Advisory/FinTech Consulting Roles Consulting Point - London £80,000 - £150,000 a year Data Architects, Data Scientists. Big Data / Analytics / Data Science. Big Data, Customer data and Information Management (IM).... Consultancy Role Finder - 23 hours ago - save job - email - more... View all Consulting Point jobs - London jobs Salary Search: IT Analyst salaries in London Learn more about working at Consulting Point","80000; -150000","http://www.indeed.co.uk/rc/clk?jk=5d2d3e63d71c1381; http://www.indeed.co.uk/jobs?q=data+scientist&l=England&start=150#; mailto:?subject=I%20found%20this%20job%20on%20Indeed&body=http://www.indeed.co.uk; http://www.indeed.co.uk/jobs?q=data+scientist&l=England&start=150#; http://www.indeed.co.uk/jobs?q=data+scientist&l=England&start=150#; http://www.indeed.co.uk/Consulting-Point-jobs; http://www.indeed.co.uk/jobs-in-London; http://www.indeed.co.uk/salaries/IT-Analyst-Salaries,-London-ENG?fromjk=5d2d3e63d71c1381&from=serp-more&campaignid=serp-more; http://www.indeed.co.uk/cmp/Consulting-Point?fromjk=5d2d3e63d71c1381&from=serp-more&campaignid=serp-more&jcid=d98473706de8b025","FS IT Advisory/FinTech Consulting Roles; save job; email; more...; ; Consulting Point jobs; London jobs; IT Analyst salaries in London; Consulting Point","FS IT Advisory/FinTech Consulting Roles; Save this job to my.indeed; ; ; Close; ; ; ; ","16"
