turnstilelink_link_1,turnstilelink_link_1/_text,turnstilelink_link_1/_title,company_content,company_link,company_link/_text,company_link/_title,turnstilelink_link_2,turnstilelink_link_2/_text,turnstilelink_link_2/_title,turnstilelink_link_2_numbers,ratingnumber_number,slnounderline_value,slnounderline_value_numbers,location_value,moreloc_link,moreloc_link/_text,moreloc_link/_title,moreloc_link_numbers,snip_value,snip_value_prices,snip_values,summary_description,resultlinktext_value,resultlinkblock_value,date_value,date_value_numbers,label,savejob_label,email_link,email_link/_text,email_link/_title,more_label,mat_contents,mat_links,mat_links/_text,mat_links/_title,content,content_prices,links,links/_text,links/_title,"_PAGE_NUMBER"
"http://www.indeed.co.uk/rc/clk?jk=88154960f558d7d0","Data Scientist, Drug Discovery","Data Scientist, Drug Discovery","GlaxoSmithKline","http://www.indeed.co.uk/cmp/Glaxosmithkline?from=SERP&campaignid=serp-linkcompanyname&fromjk=88154960f558d7d0&jcid=4e42ec53f4b93e02","GlaxoSmithKline","","http://www.indeed.co.uk/cmp/Glaxosmithkline/reviews?jcid=4e42ec53f4b93e02","4.21,549 reviews","Glaxosmithkline reviews","421.549","4.2","1,549 reviews","1549","Stevenage","","","","","","","","PhD required ( Physics, Mathematics, Data Science). You will have the opportunity to work with the best available data sets with the chance to select and...","9 days ago","","","","-","save job","mailto:?subject=I%20found%20this%20job%20on%20Indeed&body=http://www.indeed.co.uk","email","","more...","View all GlaxoSmithKline jobs - Stevenage jobs; Salary Search: Data Scientist salaries in Stevenage; Learn more about working at Glaxosmithkline","http://www.indeed.co.uk/Glaxosmithkline-jobs; http://www.indeed.co.uk/jobs-in-Stevenage; http://www.indeed.co.uk/salaries/Data-Scientist-Salaries,-Stevenage-ENG?fromjk=88154960f558d7d0&from=serp-more&campaignid=serp-more; http://www.indeed.co.uk/cmp/Glaxosmithkline?fromjk=88154960f558d7d0&from=serp-more&campaignid=serp-more&jcid=4e42ec53f4b93e02","GlaxoSmithKline jobs; Stevenage jobs; Data Scientist salaries in Stevenage; Glaxosmithkline","","Data Scientist, Drug Discovery GlaxoSmithKline - 4.21,549 reviews - Stevenage PhD required ( Physics, Mathematics, Data Science). You will have the opportunity to work with the best available data sets with the chance to select and... 9 days ago - save job - email - more... View all GlaxoSmithKline jobs - Stevenage jobs Salary Search: Data Scientist salaries in Stevenage Learn more about working at Glaxosmithkline","","http://www.indeed.co.uk/rc/clk?jk=88154960f558d7d0; http://www.indeed.co.uk/cmp/Glaxosmithkline?from=SERP&campaignid=serp-linkcompanyname&fromjk=88154960f558d7d0&jcid=4e42ec53f4b93e02; http://www.indeed.co.uk/cmp/Glaxosmithkline/reviews?jcid=4e42ec53f4b93e02; http://www.indeed.co.uk/jobs?q=data+scientist&l=England&start=40#; mailto:?subject=I%20found%20this%20job%20on%20Indeed&body=http://www.indeed.co.uk; http://www.indeed.co.uk/jobs?q=data+scientist&l=England&start=40#; http://www.indeed.co.uk/jobs?q=data+scientist&l=England&start=40#; http://www.indeed.co.uk/Glaxosmithkline-jobs; http://www.indeed.co.uk/jobs-in-Stevenage; http://www.indeed.co.uk/salaries/Data-Scientist-Salaries,-Stevenage-ENG?fromjk=88154960f558d7d0&from=serp-more&campaignid=serp-more; http://www.indeed.co.uk/cmp/Glaxosmithkline?fromjk=88154960f558d7d0&from=serp-more&campaignid=serp-more&jcid=4e42ec53f4b93e02","Data Scientist, Drug Discovery; GlaxoSmithKline; 4.21,549 reviews; save job; email; more...; ; GlaxoSmithKline jobs; Stevenage jobs; Data Scientist salaries in Stevenage; Glaxosmithkline","Data Scientist, Drug Discovery; ; Glaxosmithkline reviews; Save this job to my.indeed; ; ; Close; ; ; ; ","5"
"http://www.indeed.co.uk/rc/clk?jk=71b439f837c32987","Data Scientist, Analytics","Data Scientist, Analytics","Facebook","http://www.indeed.co.uk/cmp/Facebook?from=SERP&campaignid=serp-linkcompanyname&fromjk=71b439f837c32987&jcid=1639254ea84748b5","Facebook","","http://www.indeed.co.uk/cmp/Facebook/reviews?jcid=1639254ea84748b5","4.092 reviews","Facebook reviews","4.092","4","92 reviews","92","London","","","","","","","","The Data Scientist Analytics role has work across the following four areas:. Experience with large data sets and distributed computing (Hive/Hadoop) a plus....","21 days ago","","","","-","save job","mailto:?subject=I%20found%20this%20job%20on%20Indeed&body=http://www.indeed.co.uk","email","","more...","View all Facebook jobs - London jobs; Salary Search: Data Scientist salaries in London; Learn more about working at Facebook","http://www.indeed.co.uk/Facebook-jobs; http://www.indeed.co.uk/jobs-in-London; http://www.indeed.co.uk/salaries/Data-Scientist-Salaries,-London-ENG?fromjk=71b439f837c32987&from=serp-more&campaignid=serp-more; http://www.indeed.co.uk/cmp/Facebook?fromjk=71b439f837c32987&from=serp-more&campaignid=serp-more&jcid=1639254ea84748b5","Facebook jobs; London jobs; Data Scientist salaries in London; Facebook","","Data Scientist, Analytics Facebook - 4.092 reviews - London The Data Scientist Analytics role has work across the following four areas:. Experience with large data sets and distributed computing (Hive/Hadoop) a plus.... 21 days ago - save job - email - more... View all Facebook jobs - London jobs Salary Search: Data Scientist salaries in London Learn more about working at Facebook","","http://www.indeed.co.uk/rc/clk?jk=71b439f837c32987; http://www.indeed.co.uk/cmp/Facebook?from=SERP&campaignid=serp-linkcompanyname&fromjk=71b439f837c32987&jcid=1639254ea84748b5; http://www.indeed.co.uk/cmp/Facebook/reviews?jcid=1639254ea84748b5; http://www.indeed.co.uk/jobs?q=data+scientist&l=England&start=50#; mailto:?subject=I%20found%20this%20job%20on%20Indeed&body=http://www.indeed.co.uk; http://www.indeed.co.uk/jobs?q=data+scientist&l=England&start=50#; http://www.indeed.co.uk/jobs?q=data+scientist&l=England&start=50#; http://www.indeed.co.uk/Facebook-jobs; http://www.indeed.co.uk/jobs-in-London; http://www.indeed.co.uk/salaries/Data-Scientist-Salaries,-London-ENG?fromjk=71b439f837c32987&from=serp-more&campaignid=serp-more; http://www.indeed.co.uk/cmp/Facebook?fromjk=71b439f837c32987&from=serp-more&campaignid=serp-more&jcid=1639254ea84748b5","Data Scientist, Analytics; Facebook; 4.092 reviews; save job; email; more...; ; Facebook jobs; London jobs; Data Scientist salaries in London; Facebook","Data Scientist, Analytics; ; Facebook reviews; Save this job to my.indeed; ; ; Close; ; ; ; ","6"
"http://www.indeed.co.uk/rc/clk?jk=a7fdfd70cb0ad66d","Principal Statistician","Principal Statistician","Defence Science and Technology Laboratory","http://www.indeed.co.uk/cmp/Defence-Science-and-Technology-Laboratory?from=SERP&campaignid=serp-linkcompanyname&fromjk=a7fdfd70cb0ad66d&jcid=c597a42db0dfa01b","Defence Science and Technology Laboratory","","http://www.indeed.co.uk/cmp/Defence-Science-and-Technology-Laboratory/reviews?jcid=c597a42db0dfa01b","5.03 reviews","","5.03","5","3 reviews","3","Salisbury SP4","","","","","£38,357 - £43,477 a year","38357; -43477","- Permanent","To provide technical leadership and statistical consultancy and advice to projects across a diverse range of defence and security domains. The successful","Civil Service","-","20 days ago","20","-","save job","mailto:?subject=I%20found%20this%20job%20on%20Indeed&body=http://www.indeed.co.uk","email","","more...","View all Defence Science and Technology Laboratory jobs - Salisbury jobs; Salary Search: Statistician salaries in Salisbury SP4; Learn more about working at Defence Science and Technology Laboratory","http://www.indeed.co.uk/Defence-Science-and-Technology-Laboratory-jobs; http://www.indeed.co.uk/jobs-in-Salisbury-SP4; http://www.indeed.co.uk/salaries/Statistician-Salaries,-Salisbury-ENG?fromjk=a7fdfd70cb0ad66d&from=serp-more&campaignid=serp-more; http://www.indeed.co.uk/cmp/Defence-Science-and-Technology-Laboratory?fromjk=a7fdfd70cb0ad66d&from=serp-more&campaignid=serp-more&jcid=c597a42db0dfa01b","Defence Science and Technology Laboratory jobs; Salisbury jobs; Statistician salaries in Salisbury SP4; Defence Science and Technology Laboratory","","Principal Statistician Defence Science and Technology Laboratory - 5.03 reviews - Salisbury SP4 £38,357 - £43,477 a year - Permanent To provide technical leadership and statistical consultancy and advice to projects across a diverse range of defence and security domains. The successful Civil Service - 20 days ago - save job - email - more... View all Defence Science and Technology Laboratory jobs - Salisbury jobs Salary Search: Statistician salaries in Salisbury SP4 Learn more about working at Defence Science and Technology Laboratory","38357; -43477","http://www.indeed.co.uk/rc/clk?jk=a7fdfd70cb0ad66d; http://www.indeed.co.uk/cmp/Defence-Science-and-Technology-Laboratory?from=SERP&campaignid=serp-linkcompanyname&fromjk=a7fdfd70cb0ad66d&jcid=c597a42db0dfa01b; http://www.indeed.co.uk/cmp/Defence-Science-and-Technology-Laboratory/reviews?jcid=c597a42db0dfa01b; http://www.indeed.co.uk/jobs?q=data+scientist&l=England&start=50#; mailto:?subject=I%20found%20this%20job%20on%20Indeed&body=http://www.indeed.co.uk; http://www.indeed.co.uk/jobs?q=data+scientist&l=England&start=50#; http://www.indeed.co.uk/jobs?q=data+scientist&l=England&start=50#; http://www.indeed.co.uk/Defence-Science-and-Technology-Laboratory-jobs; http://www.indeed.co.uk/jobs-in-Salisbury-SP4; http://www.indeed.co.uk/salaries/Statistician-Salaries,-Salisbury-ENG?fromjk=a7fdfd70cb0ad66d&from=serp-more&campaignid=serp-more; http://www.indeed.co.uk/cmp/Defence-Science-and-Technology-Laboratory?fromjk=a7fdfd70cb0ad66d&from=serp-more&campaignid=serp-more&jcid=c597a42db0dfa01b","Principal Statistician; Defence Science and Technology Laboratory; 5.03 reviews; save job; email; more...; ; Defence Science and Technology Laboratory jobs; Salisbury jobs; Statistician salaries in Salisbury SP4; Defence Science and Technology Laboratory","Principal Statistician; ; ; Save this job to my.indeed; ; ; Close; ; ; ; ","6"
"http://www.indeed.co.uk/rc/clk?jk=01905c261fb80a0d","Quantitative Analyst","Quantitative Analyst","Willis Towers Watson","http://www.indeed.co.uk/cmp/Willis-Towers-Watson?from=SERP&campaignid=serp-linkcompanyname&fromjk=01905c261fb80a0d&jcid=48cce9f584313007","Willis Towers Watson","","http://www.indeed.co.uk/cmp/Willis-Towers-Watson/reviews?jcid=48cce9f584313007","3.9184 reviews","Willis Towers Watson reviews","3.9184","3.9","184 reviews","184","London","","","","","","","","The Company The Towers Watson and Willis group of companies (the “Company” or “Willis Towers Watson”) is a leading global advisory, broking and solutions","4 days ago","","","","-","save job","mailto:?subject=I%20found%20this%20job%20on%20Indeed&body=http://www.indeed.co.uk","email","","more...","View all Willis Towers Watson jobs - London jobs; Salary Search: Quantitative Analyst salaries in London; Learn more about working at Willis Towers Watson","http://www.indeed.co.uk/Willis-Towers-Watson-jobs; http://www.indeed.co.uk/jobs-in-London; http://www.indeed.co.uk/salaries/Quantitative-Analyst-Salaries,-London-ENG?fromjk=01905c261fb80a0d&from=serp-more&campaignid=serp-more; http://www.indeed.co.uk/cmp/Willis-Towers-Watson?fromjk=01905c261fb80a0d&from=serp-more&campaignid=serp-more&jcid=48cce9f584313007","Willis Towers Watson jobs; London jobs; Quantitative Analyst salaries in London; Willis Towers Watson","","Quantitative Analyst Willis Towers Watson - 3.9184 reviews - London The Company The Towers Watson and Willis group of companies (the “Company” or “Willis Towers Watson”) is a leading global advisory, broking and solutions 4 days ago - save job - email - more... View all Willis Towers Watson jobs - London jobs Salary Search: Quantitative Analyst salaries in London Learn more about working at Willis Towers Watson","","http://www.indeed.co.uk/rc/clk?jk=01905c261fb80a0d; http://www.indeed.co.uk/cmp/Willis-Towers-Watson?from=SERP&campaignid=serp-linkcompanyname&fromjk=01905c261fb80a0d&jcid=48cce9f584313007; http://www.indeed.co.uk/cmp/Willis-Towers-Watson/reviews?jcid=48cce9f584313007; http://www.indeed.co.uk/jobs?q=data+scientist&l=England&start=50#; mailto:?subject=I%20found%20this%20job%20on%20Indeed&body=http://www.indeed.co.uk; http://www.indeed.co.uk/jobs?q=data+scientist&l=England&start=50#; http://www.indeed.co.uk/jobs?q=data+scientist&l=England&start=50#; http://www.indeed.co.uk/Willis-Towers-Watson-jobs; http://www.indeed.co.uk/jobs-in-London; http://www.indeed.co.uk/salaries/Quantitative-Analyst-Salaries,-London-ENG?fromjk=01905c261fb80a0d&from=serp-more&campaignid=serp-more; http://www.indeed.co.uk/cmp/Willis-Towers-Watson?fromjk=01905c261fb80a0d&from=serp-more&campaignid=serp-more&jcid=48cce9f584313007","Quantitative Analyst; Willis Towers Watson; 3.9184 reviews; save job; email; more...; ; Willis Towers Watson jobs; London jobs; Quantitative Analyst salaries in London; Willis Towers Watson","Quantitative Analyst; ; Willis Towers Watson reviews; Save this job to my.indeed; ; ; Close; ; ; ; ","6"
"http://www.indeed.co.uk/rc/clk?jk=e9be6e943eb636ef","Graduate Data Scientist and Software Developer","Graduate Data Scientist and Software Developer","Tessella","","","","","","","","","","","South East","","","","","","","","Data Scientist / Software Developer Location:. Understanding of data and the ability to interpret large volumes of data to draw conclusions....","Venture Marketing Group","-","9 days ago","9","-","save job","mailto:?subject=I%20found%20this%20job%20on%20Indeed&body=http://www.indeed.co.uk","email","","more...","View all Tessella jobs - South East jobs; Salary Search: Data Scientist salaries; Learn more about working at Tessella","http://www.indeed.co.uk/Tessella-jobs; http://www.indeed.co.uk/jobs-in-South-East; http://www.indeed.co.uk/salaries/Data-Scientist-Salaries?fromjk=e9be6e943eb636ef&from=serp-more&campaignid=serp-more; http://www.indeed.co.uk/cmp/Tessella?fromjk=e9be6e943eb636ef&from=serp-more&campaignid=serp-more&jcid=212af5778aa7175d","Tessella jobs; South East jobs; Data Scientist salaries; Tessella","","Graduate Data Scientist and Software Developer Tessella - South East Data Scientist / Software Developer Location:. Understanding of data and the ability to interpret large volumes of data to draw conclusions.... Venture Marketing Group - 9 days ago - save job - email - more... View all Tessella jobs - South East jobs Salary Search: Data Scientist salaries Learn more about working at Tessella","","http://www.indeed.co.uk/rc/clk?jk=e9be6e943eb636ef; http://www.indeed.co.uk/jobs?q=data+scientist&l=England&start=50#; mailto:?subject=I%20found%20this%20job%20on%20Indeed&body=http://www.indeed.co.uk; http://www.indeed.co.uk/jobs?q=data+scientist&l=England&start=50#; http://www.indeed.co.uk/jobs?q=data+scientist&l=England&start=50#; http://www.indeed.co.uk/Tessella-jobs; http://www.indeed.co.uk/jobs-in-South-East; http://www.indeed.co.uk/salaries/Data-Scientist-Salaries?fromjk=e9be6e943eb636ef&from=serp-more&campaignid=serp-more; http://www.indeed.co.uk/cmp/Tessella?fromjk=e9be6e943eb636ef&from=serp-more&campaignid=serp-more&jcid=212af5778aa7175d","Graduate Data Scientist and Software Developer; save job; email; more...; ; Tessella jobs; South East jobs; Data Scientist salaries; Tessella","Graduate Data Scientist and Software Developer; Save this job to my.indeed; ; ; Close; ; ; ; ","6"
"http://www.indeed.co.uk/rc/clk?jk=748ddc8df6711656","FX Quantitative Analyst","FX Quantitative Analyst","Man","http://www.indeed.co.uk/cmp/Man?from=SERP&campaignid=serp-linkcompanyname&fromjk=748ddc8df6711656&jcid=3ce8f80e77287080","Man","","http://www.indeed.co.uk/cmp/Man/reviews?jcid=3ce8f80e77287080","4.517 reviews","Man reviews","4.517","4.5","17 reviews","17","London","","","","","","","Permanent","About Man AHL Man AHL is a diversified quantitative investment manager dedicated to delivering a broad and innovative offering in alternative and long only","1 day ago","","","","-","save job","mailto:?subject=I%20found%20this%20job%20on%20Indeed&body=http://www.indeed.co.uk","email","","more...","View all Man jobs - London jobs; Salary Search: Quantitative Analyst salaries in London","http://www.indeed.co.uk/Man-jobs; http://www.indeed.co.uk/jobs-in-London; http://www.indeed.co.uk/salaries/Quantitative-Analyst-Salaries,-London-ENG?fromjk=748ddc8df6711656&from=serp-more&campaignid=serp-more","Man jobs; London jobs; Quantitative Analyst salaries in London","","FX Quantitative Analyst Man - 4.517 reviews - London Permanent About Man AHL Man AHL is a diversified quantitative investment manager dedicated to delivering a broad and innovative offering in alternative and long only 1 day ago - save job - email - more... View all Man jobs - London jobs Salary Search: Quantitative Analyst salaries in London","","http://www.indeed.co.uk/rc/clk?jk=748ddc8df6711656; http://www.indeed.co.uk/cmp/Man?from=SERP&campaignid=serp-linkcompanyname&fromjk=748ddc8df6711656&jcid=3ce8f80e77287080; http://www.indeed.co.uk/cmp/Man/reviews?jcid=3ce8f80e77287080; http://www.indeed.co.uk/jobs?q=data+scientist&l=England&start=50#; mailto:?subject=I%20found%20this%20job%20on%20Indeed&body=http://www.indeed.co.uk; http://www.indeed.co.uk/jobs?q=data+scientist&l=England&start=50#; http://www.indeed.co.uk/jobs?q=data+scientist&l=England&start=50#; http://www.indeed.co.uk/Man-jobs; http://www.indeed.co.uk/jobs-in-London; http://www.indeed.co.uk/salaries/Quantitative-Analyst-Salaries,-London-ENG?fromjk=748ddc8df6711656&from=serp-more&campaignid=serp-more","FX Quantitative Analyst; Man; 4.517 reviews; save job; email; more...; ; Man jobs; London jobs; Quantitative Analyst salaries in London","FX Quantitative Analyst; ; Man reviews; Save this job to my.indeed; ; ; Close; ; ; ","6"
"http://www.indeed.co.uk/rc/clk?jk=9f2a270a3fe46316","Research Scientist","Research Scientist","Google","http://www.indeed.co.uk/cmp/Google?from=SERP&campaignid=serp-linkcompanyname&fromjk=9f2a270a3fe46316&jcid=a5b4499d9e91a5c6","Google","","http://www.indeed.co.uk/cmp/Google/reviews?jcid=a5b4499d9e91a5c6","4.31,076 reviews","Google reviews","431.076","4.3","1,076 reviews","1076","London","","","","","","","","From creating experiments and prototyping implementations to designing new architectures, Research Scientists work on real-world problems including artificial...","26 days ago","","","","-","save job","mailto:?subject=I%20found%20this%20job%20on%20Indeed&body=http://www.indeed.co.uk","email","","more...","View all Google jobs - London jobs; Salary Search: Research Scientist salaries in London; Learn more about working at Google","http://www.indeed.co.uk/Google-jobs; http://www.indeed.co.uk/jobs-in-London; http://www.indeed.co.uk/salaries/Research-Scientist-Salaries,-London-ENG?fromjk=9f2a270a3fe46316&from=serp-more&campaignid=serp-more; http://www.indeed.co.uk/cmp/Google?fromjk=9f2a270a3fe46316&from=serp-more&campaignid=serp-more&jcid=a5b4499d9e91a5c6","Google jobs; London jobs; Research Scientist salaries in London; Google","","Research Scientist Google - 4.31,076 reviews - London From creating experiments and prototyping implementations to designing new architectures, Research Scientists work on real-world problems including artificial... 26 days ago - save job - email - more... View all Google jobs - London jobs Salary Search: Research Scientist salaries in London Learn more about working at Google","","http://www.indeed.co.uk/rc/clk?jk=9f2a270a3fe46316; http://www.indeed.co.uk/cmp/Google?from=SERP&campaignid=serp-linkcompanyname&fromjk=9f2a270a3fe46316&jcid=a5b4499d9e91a5c6; http://www.indeed.co.uk/cmp/Google/reviews?jcid=a5b4499d9e91a5c6; http://www.indeed.co.uk/jobs?q=data+scientist&l=England&start=50#; mailto:?subject=I%20found%20this%20job%20on%20Indeed&body=http://www.indeed.co.uk; http://www.indeed.co.uk/jobs?q=data+scientist&l=England&start=50#; http://www.indeed.co.uk/jobs?q=data+scientist&l=England&start=50#; http://www.indeed.co.uk/Google-jobs; http://www.indeed.co.uk/jobs-in-London; http://www.indeed.co.uk/salaries/Research-Scientist-Salaries,-London-ENG?fromjk=9f2a270a3fe46316&from=serp-more&campaignid=serp-more; http://www.indeed.co.uk/cmp/Google?fromjk=9f2a270a3fe46316&from=serp-more&campaignid=serp-more&jcid=a5b4499d9e91a5c6","Research Scientist; Google; 4.31,076 reviews; save job; email; more...; ; Google jobs; London jobs; Research Scientist salaries in London; Google","Research Scientist; ; Google reviews; Save this job to my.indeed; ; ; Close; ; ; ; ","6"
"http://www.indeed.co.uk/rc/clk?jk=54d8ad81b68841f3","Quantitative Analyst","Quantitative Analyst","Man","http://www.indeed.co.uk/cmp/Man?from=SERP&campaignid=serp-linkcompanyname&fromjk=54d8ad81b68841f3&jcid=3ce8f80e77287080","Man","","http://www.indeed.co.uk/cmp/Man/reviews?jcid=3ce8f80e77287080","4.517 reviews","Man reviews","4.517","4.5","17 reviews","17","London","","","","","","","Permanent","Provide data and produce bespoke research in response to client requests. AHL Quantitative Analyst....","17 days ago","","","","-","save job","mailto:?subject=I%20found%20this%20job%20on%20Indeed&body=http://www.indeed.co.uk","email","","more...","View all Man jobs - London jobs; Salary Search: Quantitative Analyst salaries in London","http://www.indeed.co.uk/Man-jobs; http://www.indeed.co.uk/jobs-in-London; http://www.indeed.co.uk/salaries/Quantitative-Analyst-Salaries,-London-ENG?fromjk=54d8ad81b68841f3&from=serp-more&campaignid=serp-more","Man jobs; London jobs; Quantitative Analyst salaries in London","","Quantitative Analyst Man - 4.517 reviews - London Permanent Provide data and produce bespoke research in response to client requests. AHL Quantitative Analyst.... 17 days ago - save job - email - more... View all Man jobs - London jobs Salary Search: Quantitative Analyst salaries in London","","http://www.indeed.co.uk/rc/clk?jk=54d8ad81b68841f3; http://www.indeed.co.uk/cmp/Man?from=SERP&campaignid=serp-linkcompanyname&fromjk=54d8ad81b68841f3&jcid=3ce8f80e77287080; http://www.indeed.co.uk/cmp/Man/reviews?jcid=3ce8f80e77287080; http://www.indeed.co.uk/jobs?q=data+scientist&l=England&start=50#; mailto:?subject=I%20found%20this%20job%20on%20Indeed&body=http://www.indeed.co.uk; http://www.indeed.co.uk/jobs?q=data+scientist&l=England&start=50#; http://www.indeed.co.uk/jobs?q=data+scientist&l=England&start=50#; http://www.indeed.co.uk/Man-jobs; http://www.indeed.co.uk/jobs-in-London; http://www.indeed.co.uk/salaries/Quantitative-Analyst-Salaries,-London-ENG?fromjk=54d8ad81b68841f3&from=serp-more&campaignid=serp-more","Quantitative Analyst; Man; 4.517 reviews; save job; email; more...; ; Man jobs; London jobs; Quantitative Analyst salaries in London","Quantitative Analyst; ; Man reviews; Save this job to my.indeed; ; ; Close; ; ; ","6"
"http://www.indeed.co.uk/rc/clk?jk=7f5fcc7f19cc9340","Data Scientist","Data Scientist","Cambridge Cognition Ltd","","","","","","","","","","","Cambridge","","","","","£30,000 a year","30000","","Time-series analysis, high-dimensional data). We are seeking a PhD level Data Scientist (potentially MSc level) to help us apply cognitive science and...","Jobs.ac.uk","-","9 days ago","9","-","save job","mailto:?subject=I%20found%20this%20job%20on%20Indeed&body=http://www.indeed.co.uk","email","","more...","View all Cambridge Cognition Ltd jobs - Cambridge jobs; Salary Search: Data Scientist salaries in Cambridge","http://www.indeed.co.uk/Cambridge-Cognition-Ltd-jobs; http://www.indeed.co.uk/jobs-in-Cambridge; http://www.indeed.co.uk/salaries/Data-Scientist-Salaries,-Cambridge-ENG?fromjk=7f5fcc7f19cc9340&from=serp-more&campaignid=serp-more","Cambridge Cognition Ltd jobs; Cambridge jobs; Data Scientist salaries in Cambridge","","Data Scientist Cambridge Cognition Ltd - Cambridge £30,000 a year Time-series analysis, high-dimensional data). We are seeking a PhD level Data Scientist (potentially MSc level) to help us apply cognitive science and... Jobs.ac.uk - 9 days ago - save job - email - more... View all Cambridge Cognition Ltd jobs - Cambridge jobs Salary Search: Data Scientist salaries in Cambridge","30000","http://www.indeed.co.uk/rc/clk?jk=7f5fcc7f19cc9340; http://www.indeed.co.uk/jobs?q=data+scientist&l=England&start=50#; mailto:?subject=I%20found%20this%20job%20on%20Indeed&body=http://www.indeed.co.uk; http://www.indeed.co.uk/jobs?q=data+scientist&l=England&start=50#; http://www.indeed.co.uk/jobs?q=data+scientist&l=England&start=50#; http://www.indeed.co.uk/Cambridge-Cognition-Ltd-jobs; http://www.indeed.co.uk/jobs-in-Cambridge; http://www.indeed.co.uk/salaries/Data-Scientist-Salaries,-Cambridge-ENG?fromjk=7f5fcc7f19cc9340&from=serp-more&campaignid=serp-more","Data Scientist; save job; email; more...; ; Cambridge Cognition Ltd jobs; Cambridge jobs; Data Scientist salaries in Cambridge","Data Scientist; Save this job to my.indeed; ; ; Close; ; ; ","6"
