turnstilelink_link_1,turnstilelink_link_1/_text,turnstilelink_link_1/_title,company_content,company_link,company_link/_text,company_link/_title,turnstilelink_link_2,turnstilelink_link_2/_text,turnstilelink_link_2/_title,turnstilelink_link_2_numbers,ratingnumber_number,slnounderline_value,slnounderline_value_numbers,location_value,moreloc_link,moreloc_link/_text,moreloc_link/_title,moreloc_link_numbers,snip_value,snip_value_prices,snip_values,summary_description,resultlinktext_value,resultlinkblock_value,date_value,date_value_numbers,label,savejob_label,email_link,email_link/_text,email_link/_title,more_label,mat_contents,mat_links,mat_links/_text,mat_links/_title,content,content_prices,links,links/_text,links/_title,"_PAGE_NUMBER"
"http://www.indeed.co.uk/rc/clk?jk=f43825a543c24c20","Quantitative Risk Analyst - London","Quantitative Risk Analyst - London","BCT Resourcing","","","","","","","","","","","London W6","","","","","£75,000 a year","75000","- Full-time, Permanent","Position: Quantitative Risk Analyst Location: London A multinational energy company search for a driven, experienced Quantitative Risk Analyst. Their risk","9 days ago","","","","-","save job","mailto:?subject=I%20found%20this%20job%20on%20Indeed&body=http://www.indeed.co.uk","email","","more...","View all BCT Resourcing jobs - London jobs; Salary Search: Quantitative Analyst salaries in London W6","http://www.indeed.co.uk/Bct-Resourcing-jobs; http://www.indeed.co.uk/jobs-in-London-W6; http://www.indeed.co.uk/salaries/Quantitative-Analyst-Salaries,-London-ENG?fromjk=f43825a543c24c20&from=serp-more&campaignid=serp-more","BCT Resourcing jobs; London jobs; Quantitative Analyst salaries in London W6","","Quantitative Risk Analyst - London BCT Resourcing - London W6 £75,000 a year - Full-time, Permanent Position: Quantitative Risk Analyst Location: London A multinational energy company search for a driven, experienced Quantitative Risk Analyst. Their risk 9 days ago - save job - email - more... View all BCT Resourcing jobs - London jobs Salary Search: Quantitative Analyst salaries in London W6","75000","http://www.indeed.co.uk/rc/clk?jk=f43825a543c24c20; http://www.indeed.co.uk/jobs?q=data+scientist&l=England&start=90#; mailto:?subject=I%20found%20this%20job%20on%20Indeed&body=http://www.indeed.co.uk; http://www.indeed.co.uk/jobs?q=data+scientist&l=England&start=90#; http://www.indeed.co.uk/jobs?q=data+scientist&l=England&start=90#; http://www.indeed.co.uk/Bct-Resourcing-jobs; http://www.indeed.co.uk/jobs-in-London-W6; http://www.indeed.co.uk/salaries/Quantitative-Analyst-Salaries,-London-ENG?fromjk=f43825a543c24c20&from=serp-more&campaignid=serp-more","Quantitative Risk Analyst - London; save job; email; more...; ; BCT Resourcing jobs; London jobs; Quantitative Analyst salaries in London W6","Quantitative Risk Analyst - London; Save this job to my.indeed; ; ; Close; ; ; ","10"
"http://www.indeed.co.uk/rc/clk?jk=8ff87dc2afa4dc42","Data Engineer","Data Engineer","Lyst","","","","","","","","","","","London","","","","","","","","Lyst are looking for a Data Engineer to help us continue to build out our data pipeline capabilities and improve the way we handle data ingestion and ETL...","30+ days ago","","","","-","save job","mailto:?subject=I%20found%20this%20job%20on%20Indeed&body=http://www.indeed.co.uk","email","","more...","View all Lyst jobs - London jobs; Salary Search: Data Warehouse Engineer salaries in London; Learn more about working at Lyst","http://www.indeed.co.uk/Lyst-jobs; http://www.indeed.co.uk/jobs-in-London; http://www.indeed.co.uk/salaries/Data-Warehouse-Engineer-Salaries,-London-ENG?fromjk=8ff87dc2afa4dc42&from=serp-more&campaignid=serp-more; http://www.indeed.co.uk/cmp/Lyst?fromjk=8ff87dc2afa4dc42&from=serp-more&campaignid=serp-more&jcid=961b94f8b0e7e69c","Lyst jobs; London jobs; Data Warehouse Engineer salaries in London; Lyst","","Data Engineer Lyst - London Lyst are looking for a Data Engineer to help us continue to build out our data pipeline capabilities and improve the way we handle data ingestion and ETL... 30+ days ago - save job - email - more... View all Lyst jobs - London jobs Salary Search: Data Warehouse Engineer salaries in London Learn more about working at Lyst","","http://www.indeed.co.uk/rc/clk?jk=8ff87dc2afa4dc42; http://www.indeed.co.uk/jobs?q=data+scientist&l=England&start=90#; mailto:?subject=I%20found%20this%20job%20on%20Indeed&body=http://www.indeed.co.uk; http://www.indeed.co.uk/jobs?q=data+scientist&l=England&start=90#; http://www.indeed.co.uk/jobs?q=data+scientist&l=England&start=90#; http://www.indeed.co.uk/Lyst-jobs; http://www.indeed.co.uk/jobs-in-London; http://www.indeed.co.uk/salaries/Data-Warehouse-Engineer-Salaries,-London-ENG?fromjk=8ff87dc2afa4dc42&from=serp-more&campaignid=serp-more; http://www.indeed.co.uk/cmp/Lyst?fromjk=8ff87dc2afa4dc42&from=serp-more&campaignid=serp-more&jcid=961b94f8b0e7e69c","Data Engineer; save job; email; more...; ; Lyst jobs; London jobs; Data Warehouse Engineer salaries in London; Lyst","Data Engineer; Save this job to my.indeed; ; ; Close; ; ; ; ","10"
"http://www.indeed.co.uk/rc/clk?jk=4215db315b0bf84f","QC Data Scientist","QC Data Scientist","Patheon Inc.","http://www.indeed.co.uk/cmp/Patheon-Inc.?from=SERP&campaignid=serp-linkcompanyname&fromjk=4215db315b0bf84f&jcid=6b41dbc41bc599f3","Patheon Inc.","","http://www.indeed.co.uk/cmp/Patheon-Inc./reviews?jcid=6b41dbc41bc599f3","4.03 reviews","Patheon reviews","4.03","4","3 reviews","3","Swindon","","","","","","","","Check calculations and data transcriptions for accuracy. Liaise with analytical scientists to ensure all necessary corrections are made....","26 days ago","","","","-","save job","mailto:?subject=I%20found%20this%20job%20on%20Indeed&body=http://www.indeed.co.uk","email","","more...","View all Patheon Inc. jobs - Swindon jobs; Salary Search: Data Scientist salaries in Swindon","http://www.indeed.co.uk/Patheon-Inc.-jobs; http://www.indeed.co.uk/jobs-in-Swindon; http://www.indeed.co.uk/salaries/Data-Scientist-Salaries,-Swindon-ENG?fromjk=4215db315b0bf84f&from=serp-more&campaignid=serp-more","Patheon Inc. jobs; Swindon jobs; Data Scientist salaries in Swindon","","QC Data Scientist Patheon Inc. - 4.03 reviews - Swindon Check calculations and data transcriptions for accuracy. Liaise with analytical scientists to ensure all necessary corrections are made.... 26 days ago - save job - email - more... View all Patheon Inc. jobs - Swindon jobs Salary Search: Data Scientist salaries in Swindon","","http://www.indeed.co.uk/rc/clk?jk=4215db315b0bf84f; http://www.indeed.co.uk/cmp/Patheon-Inc.?from=SERP&campaignid=serp-linkcompanyname&fromjk=4215db315b0bf84f&jcid=6b41dbc41bc599f3; http://www.indeed.co.uk/cmp/Patheon-Inc./reviews?jcid=6b41dbc41bc599f3; http://www.indeed.co.uk/jobs?q=data+scientist&l=England&start=90#; mailto:?subject=I%20found%20this%20job%20on%20Indeed&body=http://www.indeed.co.uk; http://www.indeed.co.uk/jobs?q=data+scientist&l=England&start=90#; http://www.indeed.co.uk/jobs?q=data+scientist&l=England&start=90#; http://www.indeed.co.uk/Patheon-Inc.-jobs; http://www.indeed.co.uk/jobs-in-Swindon; http://www.indeed.co.uk/salaries/Data-Scientist-Salaries,-Swindon-ENG?fromjk=4215db315b0bf84f&from=serp-more&campaignid=serp-more","QC Data Scientist; Patheon Inc.; 4.03 reviews; save job; email; more...; ; Patheon Inc. jobs; Swindon jobs; Data Scientist salaries in Swindon","QC Data Scientist; ; Patheon reviews; Save this job to my.indeed; ; ; Close; ; ; ","10"
"http://www.indeed.co.uk/rc/clk?jk=f5bc967c32b529e2","Data Scientist","Data Scientist","King.com","","","","","","","","","","","London","","","","","","","","We are looking for a talented and creative Senior Data Scientist for our London studio. As a data scientist at King, your role will be focused on a particular...","30+ days ago","","","","-","save job","mailto:?subject=I%20found%20this%20job%20on%20Indeed&body=http://www.indeed.co.uk","email","","more...","View all King.com jobs - London jobs; Salary Search: Data Scientist salaries in London","http://www.indeed.co.uk/King.com-jobs; http://www.indeed.co.uk/jobs-in-London; http://www.indeed.co.uk/salaries/Data-Scientist-Salaries,-London-ENG?fromjk=f5bc967c32b529e2&from=serp-more&campaignid=serp-more","King.com jobs; London jobs; Data Scientist salaries in London","","Data Scientist King.com - London We are looking for a talented and creative Senior Data Scientist for our London studio. As a data scientist at King, your role will be focused on a particular... 30+ days ago - save job - email - more... View all King.com jobs - London jobs Salary Search: Data Scientist salaries in London","","http://www.indeed.co.uk/rc/clk?jk=f5bc967c32b529e2; http://www.indeed.co.uk/jobs?q=data+scientist&l=England&start=90#; mailto:?subject=I%20found%20this%20job%20on%20Indeed&body=http://www.indeed.co.uk; http://www.indeed.co.uk/jobs?q=data+scientist&l=England&start=90#; http://www.indeed.co.uk/jobs?q=data+scientist&l=England&start=90#; http://www.indeed.co.uk/King.com-jobs; http://www.indeed.co.uk/jobs-in-London; http://www.indeed.co.uk/salaries/Data-Scientist-Salaries,-London-ENG?fromjk=f5bc967c32b529e2&from=serp-more&campaignid=serp-more","Data Scientist; save job; email; more...; ; King.com jobs; London jobs; Data Scientist salaries in London","Data Scientist; Save this job to my.indeed; ; ; Close; ; ; ","10"
"http://www.indeed.co.uk/rc/clk?jk=4b5b7206b0d245a6","Data Engineer - Mendeley","Data Engineer - Mendeley","Reed Elsevier","http://www.indeed.co.uk/cmp/Reed-Elsevier?from=SERP&campaignid=serp-linkcompanyname&fromjk=4b5b7206b0d245a6&jcid=f7a0f0e88ce3d78e","Reed Elsevier","","http://www.indeed.co.uk/cmp/Reed-Elsevier/reviews?jcid=f7a0f0e88ce3d78e","3.725 reviews","Reed Elsevier reviews","3.725","3.7","25 reviews","25","London","","","","","","","","Working with Data Scientists and Product Managers to ensure software is high quality and meets user requirements. As a Data Engineer you will be:....","30+ days ago","","","","-","save job","mailto:?subject=I%20found%20this%20job%20on%20Indeed&body=http://www.indeed.co.uk","email","","more...","View all Reed Elsevier jobs - London jobs; Salary Search: Data Warehouse Engineer salaries in London","http://www.indeed.co.uk/Reed-Elsevier-jobs; http://www.indeed.co.uk/jobs-in-London; http://www.indeed.co.uk/salaries/Data-Warehouse-Engineer-Salaries,-London-ENG?fromjk=4b5b7206b0d245a6&from=serp-more&campaignid=serp-more","Reed Elsevier jobs; London jobs; Data Warehouse Engineer salaries in London","","Data Engineer - Mendeley Reed Elsevier - 3.725 reviews - London Working with Data Scientists and Product Managers to ensure software is high quality and meets user requirements. As a Data Engineer you will be:.... 30+ days ago - save job - email - more... View all Reed Elsevier jobs - London jobs Salary Search: Data Warehouse Engineer salaries in London","","http://www.indeed.co.uk/rc/clk?jk=4b5b7206b0d245a6; http://www.indeed.co.uk/cmp/Reed-Elsevier?from=SERP&campaignid=serp-linkcompanyname&fromjk=4b5b7206b0d245a6&jcid=f7a0f0e88ce3d78e; http://www.indeed.co.uk/cmp/Reed-Elsevier/reviews?jcid=f7a0f0e88ce3d78e; http://www.indeed.co.uk/jobs?q=data+scientist&l=England&start=90#; mailto:?subject=I%20found%20this%20job%20on%20Indeed&body=http://www.indeed.co.uk; http://www.indeed.co.uk/jobs?q=data+scientist&l=England&start=90#; http://www.indeed.co.uk/jobs?q=data+scientist&l=England&start=90#; http://www.indeed.co.uk/Reed-Elsevier-jobs; http://www.indeed.co.uk/jobs-in-London; http://www.indeed.co.uk/salaries/Data-Warehouse-Engineer-Salaries,-London-ENG?fromjk=4b5b7206b0d245a6&from=serp-more&campaignid=serp-more","Data Engineer - Mendeley; Reed Elsevier; 3.725 reviews; save job; email; more...; ; Reed Elsevier jobs; London jobs; Data Warehouse Engineer salaries in London","Data Engineer - Mendeley; ; Reed Elsevier reviews; Save this job to my.indeed; ; ; Close; ; ; ","10"
"http://www.indeed.co.uk/rc/clk?jk=7634a880b03ff623","Database Developer (SQL)","Database Developer (SQL)","ThinkersConnect","","","","","","","","","","","London","","","","","£60,000 - £70,000 a year","60000; -70000","- Permanent","Assist data scientists with data analysis and research. Experience using Redgate tools or SQL Server Data Tools in production environments....","27 days ago","","","","-","save job","mailto:?subject=I%20found%20this%20job%20on%20Indeed&body=http://www.indeed.co.uk","email","","more...","View all ThinkersConnect jobs - London jobs; Salary Search: Database Developer salaries in London","http://www.indeed.co.uk/Thinkersconnect-jobs; http://www.indeed.co.uk/jobs-in-London; http://www.indeed.co.uk/salaries/Database-Developer-Salaries,-London-ENG?fromjk=7634a880b03ff623&from=serp-more&campaignid=serp-more","ThinkersConnect jobs; London jobs; Database Developer salaries in London","","Database Developer (SQL) ThinkersConnect - London £60,000 - £70,000 a year - Permanent Assist data scientists with data analysis and research. Experience using Redgate tools or SQL Server Data Tools in production environments.... 27 days ago - save job - email - more... View all ThinkersConnect jobs - London jobs Salary Search: Database Developer salaries in London","60000; -70000","http://www.indeed.co.uk/rc/clk?jk=7634a880b03ff623; http://www.indeed.co.uk/jobs?q=data+scientist&l=England&start=90#; mailto:?subject=I%20found%20this%20job%20on%20Indeed&body=http://www.indeed.co.uk; http://www.indeed.co.uk/jobs?q=data+scientist&l=England&start=90#; http://www.indeed.co.uk/jobs?q=data+scientist&l=England&start=90#; http://www.indeed.co.uk/Thinkersconnect-jobs; http://www.indeed.co.uk/jobs-in-London; http://www.indeed.co.uk/salaries/Database-Developer-Salaries,-London-ENG?fromjk=7634a880b03ff623&from=serp-more&campaignid=serp-more","Database Developer (SQL); save job; email; more...; ; ThinkersConnect jobs; London jobs; Database Developer salaries in London","Database Developer (SQL); Save this job to my.indeed; ; ; Close; ; ; ","10"
"http://www.indeed.co.uk/rc/clk?jk=53e22eca152c7ff8","Machine Learning Analyst","Machine Learning Analyst","G-Research","","","","","","","","","","","London","","","","","","","","The team are developing machine learning techniques and applying them to seek patterns in large, dirty and noisy data sets....","30+ days ago","","","","-","save job","mailto:?subject=I%20found%20this%20job%20on%20Indeed&body=http://www.indeed.co.uk","email","","more...","View all G-Research jobs - London jobs; Salary Search: Machine Learning Engineer salaries in London; Learn more about working at G-research","http://www.indeed.co.uk/jobs?q=G-research; http://www.indeed.co.uk/jobs-in-London; http://www.indeed.co.uk/salaries/Machine-Learning-Engineer-Salaries,-London-ENG?fromjk=53e22eca152c7ff8&from=serp-more&campaignid=serp-more; http://www.indeed.co.uk/cmp/G--research?fromjk=53e22eca152c7ff8&from=serp-more&campaignid=serp-more&jcid=bfc6d5986da7117e","G-Research jobs; London jobs; Machine Learning Engineer salaries in London; G-research","","Machine Learning Analyst G-Research - London The team are developing machine learning techniques and applying them to seek patterns in large, dirty and noisy data sets.... 30+ days ago - save job - email - more... View all G-Research jobs - London jobs Salary Search: Machine Learning Engineer salaries in London Learn more about working at G-research","","http://www.indeed.co.uk/rc/clk?jk=53e22eca152c7ff8; http://www.indeed.co.uk/jobs?q=data+scientist&l=England&start=90#; mailto:?subject=I%20found%20this%20job%20on%20Indeed&body=http://www.indeed.co.uk; http://www.indeed.co.uk/jobs?q=data+scientist&l=England&start=90#; http://www.indeed.co.uk/jobs?q=data+scientist&l=England&start=90#; http://www.indeed.co.uk/jobs?q=G-research; http://www.indeed.co.uk/jobs-in-London; http://www.indeed.co.uk/salaries/Machine-Learning-Engineer-Salaries,-London-ENG?fromjk=53e22eca152c7ff8&from=serp-more&campaignid=serp-more; http://www.indeed.co.uk/cmp/G--research?fromjk=53e22eca152c7ff8&from=serp-more&campaignid=serp-more&jcid=bfc6d5986da7117e","Machine Learning Analyst; save job; email; more...; ; G-Research jobs; London jobs; Machine Learning Engineer salaries in London; G-research","Machine Learning Analyst; Save this job to my.indeed; ; ; Close; ; ; ; ","10"
"http://www.indeed.co.uk/rc/clk?jk=8903a9a8475070dd","Machine Learning Engineer C++, Python, Matlab, R, statistics...","Machine Learning Engineer C++, Python, Matlab, R, statistics, CUDA","TRG","","","","","","","","","","","Manchester","","","","","£40,000 a year","40000","- Permanent","Experience with state-of-the-art data mining and classification techniques. Do you apply Machine Learning to big data problems?...","Jobsite UK","-","11 days ago","11","-","save job","mailto:?subject=I%20found%20this%20job%20on%20Indeed&body=http://www.indeed.co.uk","email","","more...","View all TRG jobs - Manchester jobs; Salary Search: Machine Learning Engineer salaries in Manchester; Learn more about working at Trg","http://www.indeed.co.uk/Trg-jobs; http://www.indeed.co.uk/jobs-in-Manchester; http://www.indeed.co.uk/salaries/Machine-Learning-Engineer-Salaries,-Manchester-ENG?fromjk=8903a9a8475070dd&from=serp-more&campaignid=serp-more; http://www.indeed.co.uk/cmp/Ibex-Global?fromjk=8903a9a8475070dd&from=serp-more&campaignid=serp-more&jcid=2d85ca0d1f1aad67","TRG jobs; Manchester jobs; Machine Learning Engineer salaries in Manchester; Trg","","Machine Learning Engineer C++, Python, Matlab, R, statistics... TRG - Manchester £40,000 a year - Permanent Experience with state-of-the-art data mining and classification techniques. Do you apply Machine Learning to big data problems?... Jobsite UK - 11 days ago - save job - email - more... View all TRG jobs - Manchester jobs Salary Search: Machine Learning Engineer salaries in Manchester Learn more about working at Trg","40000","http://www.indeed.co.uk/rc/clk?jk=8903a9a8475070dd; http://www.indeed.co.uk/jobs?q=data+scientist&l=England&start=100#; mailto:?subject=I%20found%20this%20job%20on%20Indeed&body=http://www.indeed.co.uk; http://www.indeed.co.uk/jobs?q=data+scientist&l=England&start=100#; http://www.indeed.co.uk/jobs?q=data+scientist&l=England&start=100#; http://www.indeed.co.uk/Trg-jobs; http://www.indeed.co.uk/jobs-in-Manchester; http://www.indeed.co.uk/salaries/Machine-Learning-Engineer-Salaries,-Manchester-ENG?fromjk=8903a9a8475070dd&from=serp-more&campaignid=serp-more; http://www.indeed.co.uk/cmp/Ibex-Global?fromjk=8903a9a8475070dd&from=serp-more&campaignid=serp-more&jcid=2d85ca0d1f1aad67","Machine Learning Engineer C++, Python, Matlab, R, statistics...; save job; email; more...; ; TRG jobs; Manchester jobs; Machine Learning Engineer salaries in Manchester; Trg","Machine Learning Engineer C++, Python, Matlab, R, statistics, CUDA; Save this job to my.indeed; ; ; Close; ; ; ; ","11"
"http://www.indeed.co.uk/rc/clk?jk=e02cf2399b8020b4","Data Engineer","Data Engineer","Clearcube Consulting Limited","","","","","","","","","","","London","","","","","£50,000 - £85,000 a year","50000; -85000","- Permanent","As the first dedicated Data Engineer you will be joining a team of three Data Scientists, you will work with people in technical and commercial teams to...","Jobsite UK","-","2 days ago","2","-","save job","mailto:?subject=I%20found%20this%20job%20on%20Indeed&body=http://www.indeed.co.uk","email","","more...","View all Clearcube Consulting Limited jobs - London jobs; Salary Search: Data Warehouse Engineer salaries in London","http://www.indeed.co.uk/Clearcube-Consulting-Limited-jobs; http://www.indeed.co.uk/jobs-in-London; http://www.indeed.co.uk/salaries/Data-Warehouse-Engineer-Salaries,-London-ENG?fromjk=e02cf2399b8020b4&from=serp-more&campaignid=serp-more","Clearcube Consulting Limited jobs; London jobs; Data Warehouse Engineer salaries in London","","Data Engineer Clearcube Consulting Limited - London £50,000 - £85,000 a year - Permanent As the first dedicated Data Engineer you will be joining a team of three Data Scientists, you will work with people in technical and commercial teams to... Jobsite UK - 2 days ago - save job - email - more... View all Clearcube Consulting Limited jobs - London jobs Salary Search: Data Warehouse Engineer salaries in London","50000; -85000","http://www.indeed.co.uk/rc/clk?jk=e02cf2399b8020b4; http://www.indeed.co.uk/jobs?q=data+scientist&l=England&start=100#; mailto:?subject=I%20found%20this%20job%20on%20Indeed&body=http://www.indeed.co.uk; http://www.indeed.co.uk/jobs?q=data+scientist&l=England&start=100#; http://www.indeed.co.uk/jobs?q=data+scientist&l=England&start=100#; http://www.indeed.co.uk/Clearcube-Consulting-Limited-jobs; http://www.indeed.co.uk/jobs-in-London; http://www.indeed.co.uk/salaries/Data-Warehouse-Engineer-Salaries,-London-ENG?fromjk=e02cf2399b8020b4&from=serp-more&campaignid=serp-more","Data Engineer; save job; email; more...; ; Clearcube Consulting Limited jobs; London jobs; Data Warehouse Engineer salaries in London","Data Engineer; Save this job to my.indeed; ; ; Close; ; ; ","11"
"http://www.indeed.co.uk/rc/clk?jk=a770178a4571e055","Data Scientist","Data Scientist","Screwfix","http://www.indeed.co.uk/cmp/Screwfix?from=SERP&campaignid=serp-linkcompanyname&fromjk=a770178a4571e055&jcid=5c9d319e3396f060","Screwfix","","http://www.indeed.co.uk/cmp/Screwfix/reviews?jcid=5c9d319e3396f060","3.4147 reviews","Screwfix reviews","3.4147","3.4","147 reviews","147","England","","","","","£30,000 a year","30000","","The Data Scientist role. The skills you’ll need as a Data Scientist. This will involve analysing and deciphering large data sets to inform and guide key...","30+ days ago","","","","-","save job","mailto:?subject=I%20found%20this%20job%20on%20Indeed&body=http://www.indeed.co.uk","email","","more...","View all Screwfix jobs - England jobs; Salary Search: Data Scientist salaries; Learn more about working at Screwfix","http://www.indeed.co.uk/Screwfix-jobs; http://www.indeed.co.uk/jobs-in-England; http://www.indeed.co.uk/salaries/Data-Scientist-Salaries?fromjk=a770178a4571e055&from=serp-more&campaignid=serp-more; http://www.indeed.co.uk/cmp/Screwfix?fromjk=a770178a4571e055&from=serp-more&campaignid=serp-more&jcid=5c9d319e3396f060","Screwfix jobs; England jobs; Data Scientist salaries; Screwfix","","Data Scientist Screwfix - 3.4147 reviews - England +1 location £30,000 a year The Data Scientist role. The skills you’ll need as a Data Scientist. This will involve analysing and deciphering large data sets to inform and guide key... 30+ days ago - save job - email - more... View all Screwfix jobs - England jobs Salary Search: Data Scientist salaries Learn more about working at Screwfix","30000","http://www.indeed.co.uk/rc/clk?jk=a770178a4571e055; http://www.indeed.co.uk/cmp/Screwfix?from=SERP&campaignid=serp-linkcompanyname&fromjk=a770178a4571e055&jcid=5c9d319e3396f060; http://www.indeed.co.uk/cmp/Screwfix/reviews?jcid=5c9d319e3396f060; http://www.indeed.co.uk/jobs?q=data+scientist&l=England&rbt=Data+Scientist&rbc=Screwfix&jtid=1872a3288ede048a&jcid=5c9d319e3396f060&grp=tcl; http://www.indeed.co.uk/jobs?q=data+scientist&l=England&start=100#; mailto:?subject=I%20found%20this%20job%20on%20Indeed&body=http://www.indeed.co.uk; http://www.indeed.co.uk/jobs?q=data+scientist&l=England&start=100#; http://www.indeed.co.uk/jobs?q=data+scientist&l=England&start=100#; http://www.indeed.co.uk/Screwfix-jobs; http://www.indeed.co.uk/jobs-in-England; http://www.indeed.co.uk/salaries/Data-Scientist-Salaries?fromjk=a770178a4571e055&from=serp-more&campaignid=serp-more; http://www.indeed.co.uk/cmp/Screwfix?fromjk=a770178a4571e055&from=serp-more&campaignid=serp-more&jcid=5c9d319e3396f060","Data Scientist; Screwfix; 3.4147 reviews; +1 location; save job; email; more...; ; Screwfix jobs; England jobs; Data Scientist salaries; Screwfix","Data Scientist; ; Screwfix reviews; ; Save this job to my.indeed; ; ; Close; ; ; ; ","11"
